{
  "schema_version": "compression_audit_pilot_v02_1",
  "protocol": "v0.2-development",
  "development_only": true,
  "independent_validation": false,
  "seed": 20260912,
  "model": "qwen3.8-flash",
  "judge_model": "qwen3.8-flash",
  "region": "cn-beijing",
  "temperature": 0,
  "enable_thinking": false,
  "max_output_tokens": 2048,
  "history_budget_tokens": 1536,
  "ingest_budget_tokens": 768,
  "request_input_tokens_hard_max": 65536,
  "request_count_hard_max": 1298,
  "cost_cap_cny": 100,
  "timeout_seconds": 60,
  "tokenizer": null,
  "pricing_snapshot": {
    "date": "2026-09-12",
    "source": "https://help.aliyun.com/en/model-studio/qwen3-8-flash",
    "input_per_million": 0.8,
    "output_per_million": 2.7,
    "region": "cn-beijing"
  },
  "authorization": {
    "authorized_by_user": false,
    "authorization_id": null,
    "date": null
  },
  "gates": {
    "judge_holdout_correct": 36,
    "judge_critical_false_positives": 0,
    "first_format_valid": 36,
    "final_format_valid": 38,
    "full_pass": 20,
    "oracle_pass": 14
  }
}
